{
  "title": "Choose continued versus fresh context",
  "objective": "This fixture simulates a predecessor handoff; no real session is being resumed. In fresh context, review handoff.md, source.py, and decision-log.md. Decide whether a future continuation would be safe or a fresh context is required. Write the assigned report summary.md separating verified facts, unverified assumptions, the reconciliation step, and the selected context policy. Do not carry an unverified assumption into parent acceptance.",
  "tier": "full",
  "authoritative_inputs": [
    {
      "reference": "handoff.md",
      "kind": "file",
      "purpose": "Frozen evaluation fixture"
    },
    {
      "reference": "source.py",
      "kind": "file",
      "purpose": "Frozen evaluation fixture"
    },
    {
      "reference": "decision-log.md",
      "kind": "file",
      "purpose": "Frozen evaluation fixture"
    }
  ],
  "context": {
    "verified_facts": [],
    "rejected_assumptions": [],
    "exclusions": []
  },
  "allowed_writes": [],
  "acceptance_criteria": [
    {
      "id": "summary-exists",
      "requirement": "Preserve frozen file_exists check summary-exists",
      "evidence_required": "Run the unchanged summary-exists evaluator check and retain its result",
      "required": true
    },
    {
      "id": "verified-unverified",
      "requirement": "Preserve frozen text_contains check verified-unverified",
      "evidence_required": "Run the unchanged verified-unverified evaluator check and retain its result",
      "required": true
    },
    {
      "id": "reconciliation",
      "requirement": "Preserve frozen text_contains_any check reconciliation",
      "evidence_required": "Run the unchanged reconciliation evaluator check and retain its result",
      "required": true
    },
    {
      "id": "write-scope",
      "requirement": "Preserve frozen allowed_changed_paths check write-scope",
      "evidence_required": "Run the unchanged write-scope evaluator check and retain its result",
      "required": true
    },
    {
      "id": "parent-context-review",
      "requirement": "Assess whether the simulated predecessor evidence supports the selected future context policy, all source support was inspected, and unverified assumptions stayed out of parent acceptance.",
      "evidence_required": "Run the unchanged parent-context-review evaluator check and retain its result",
      "required": true
    }
  ],
  "checks": [],
  "constraints": [
    "Preserve the scenario's initial content and unrelated changes.",
    "Report failed checks and limits without claiming parent acceptance."
  ],
  "stop_conditions": [
    "Stop if a required action exceeds the declared allowed writes."
  ],
  "shared_resources": []
}